{
 "floor": "std",
 "zone_ref": "skeleton.json#zones[std]",
 "partitions": {
  "main": "outline"
 },
 "walls": [
  {
   "key": "1F:int:0",
   "kind": "int",
   "t_mm": 120,
   "axis": [
    [
     258,
     730
    ],
    [
     258,
     4230
    ]
   ]
  },
  {
   "key": "1F:int:1",
   "kind": "int",
   "t_mm": 120,
   "axis": [
    [
     858,
     730
    ],
    [
     258,
     730
    ]
   ]
  },
  {
   "key": "1F:int:2",
   "kind": "int",
   "t_mm": 120,
   "axis": [
    [
     258,
     4230
    ],
    [
     2158,
     4230
    ]
   ]
  },
  {
   "key": "1F:int:3",
   "kind": "int",
   "t_mm": 120,
   "axis": [
    [
     258,
     8930
    ],
    [
     258,
     12030
    ]
   ]
  },
  {
   "key": "1F:int:4",
   "kind": "int",
   "t_mm": 120,
   "axis": [
    [
     2058,
     8930
    ],
    [
     258,
     8930
    ]
   ]
  },
  {
   "key": "1F:int:5",
   "kind": "int",
   "t_mm": 120,
   "axis": [
    [
     258,
     12030
    ],
    [
     1058,
     12030
    ]
   ]
  },
  {
   "key": "1F:int:6",
   "kind": "int",
   "t_mm": 120,
   "axis": [
    [
     858,
     630
    ],
    [
     858,
     730
    ]
   ]
  },
  {
   "key": "1F:int:7",
   "kind": "int",
   "t_mm": 120,
   "axis": [
    [
     2258,
     630
    ],
    [
     858,
     630
    ]
   ]
  },
  {
   "key": "1F:int:8",
   "kind": "int",
   "t_mm": 120,
   "axis": [
    [
     1058,
     12030
    ],
    [
     1058,
     12130
    ]
   ]
  },
  {
   "key": "1F:int:9",
   "kind": "int",
   "t_mm": 120,
   "axis": [
    [
     1058,
     12130
    ],
    [
     2258,
     12130
    ]
   ]
  },
  {
   "key": "1F:int:10",
   "kind": "int",
   "t_mm": 120,
   "axis": [
    [
     2158,
     9130
    ],
    [
     2058,
     8930
    ]
   ]
  },
  {
   "key": "1F:int:11",
   "kind": "int",
   "t_mm": 120,
   "axis": [
    [
     2158,
     4230
    ],
    [
     2158,
     4730
    ]
   ]
  },
  {
   "key": "1F:int:12",
   "kind": "int",
   "t_mm": 120,
   "axis": [
    [
     2158,
     4730
    ],
    [
     2358,
     4830
    ]
   ]
  },
  {
   "key": "1F:int:13",
   "kind": "int",
   "t_mm": 120,
   "axis": [
    [
     2258,
     9130
    ],
    [
     2158,
     9130
    ]
   ]
  },
  {
   "key": "1F:int:14",
   "kind": "int",
   "t_mm": 120,
   "axis": [
    [
     2358,
     830
    ],
    [
     2258,
     630
    ]
   ]
  },
  {
   "key": "1F:int:15",
   "kind": "int",
   "t_mm": 120,
   "axis": [
    [
     2258,
     9230
    ],
    [
     2258,
     9130
    ]
   ]
  },
  {
   "key": "1F:int:16",
   "kind": "int",
   "t_mm": 120,
   "axis": [
    [
     2358,
     9230
    ],
    [
     2258,
     9230
    ]
   ]
  },
  {
   "key": "1F:int:17",
   "kind": "int",
   "t_mm": 120,
   "axis": [
    [
     2258,
     12130
    ],
    [
     2258,
     12030
    ]
   ]
  },
  {
   "key": "1F:int:18",
   "kind": "int",
   "t_mm": 120,
   "axis": [
    [
     2258,
     12030
    ],
    [
     2958,
     12030
    ]
   ]
  },
  {
   "key": "1F:int:19",
   "kind": "int",
   "t_mm": 120,
   "axis": [
    [
     2458,
     830
    ],
    [
     2358,
     830
    ]
   ]
  },
  {
   "key": "1F:int:20",
   "kind": "int",
   "t_mm": 120,
   "axis": [
    [
     2358,
     4830
    ],
    [
     2358,
     5030
    ]
   ]
  },
  {
   "key": "1F:int:21",
   "kind": "int",
   "t_mm": 120,
   "axis": [
    [
     2358,
     5030
    ],
    [
     2458,
     5030
    ]
   ]
  },
  {
   "key": "1F:int:22",
   "kind": "int",
   "t_mm": 120,
   "axis": [
    [
     2358,
     9330
    ],
    [
     2358,
     9230
    ]
   ]
  },
  {
   "key": "1F:int:23",
   "kind": "int",
   "t_mm": 120,
   "axis": [
    [
     2458,
     9330
    ],
    [
     2358,
     9330
    ]
   ]
  },
  {
   "key": "1F:int:24",
   "kind": "int",
   "t_mm": 120,
   "axis": [
    [
     2558,
     1230
    ],
    [
     2458,
     830
    ]
   ]
  },
  {
   "key": "1F:int:25",
   "kind": "int",
   "t_mm": 120,
   "axis": [
    [
     2458,
     5030
    ],
    [
     2458,
     5130
    ]
   ]
  },
  {
   "key": "1F:int:26",
   "kind": "int",
   "t_mm": 120,
   "axis": [
    [
     2458,
     5130
    ],
    [
     2558,
     5130
    ]
   ]
  },
  {
   "key": "1F:int:27",
   "kind": "int",
   "t_mm": 120,
   "axis": [
    [
     2458,
     9430
    ],
    [
     2458,
     9330
    ]
   ]
  },
  {
   "key": "1F:int:28",
   "kind": "int",
   "t_mm": 120,
   "axis": [
    [
     2558,
     9430
    ],
    [
     2458,
     9430
    ]
   ]
  },
  {
   "key": "1F:int:29",
   "kind": "int",
   "t_mm": 120,
   "axis": [
    [
     2658,
     1230
    ],
    [
     2558,
     1230
    ]
   ]
  },
  {
   "key": "1F:int:30",
   "kind": "int",
   "t_mm": 120,
   "axis": [
    [
     2558,
     5130
    ],
    [
     2558,
     5230
    ]
   ]
  },
  {
   "key": "1F:int:31",
   "kind": "int",
   "t_mm": 120,
   "axis": [
    [
     2558,
     5230
    ],
    [
     2758,
     5330
    ]
   ]
  },
  {
   "key": "1F:int:32",
   "kind": "int",
   "t_mm": 120,
   "axis": [
    [
     2558,
     9530
    ],
    [
     2558,
     9430
    ]
   ]
  },
  {
   "key": "1F:int:33",
   "kind": "int",
   "t_mm": 120,
   "axis": [
    [
     2658,
     9530
    ],
    [
     2558,
     9530
    ]
   ]
  },
  {
   "key": "1F:int:34",
   "kind": "int",
   "t_mm": 120,
   "axis": [
    [
     2658,
     1530
    ],
    [
     2658,
     1230
    ]
   ]
  },
  {
   "key": "1F:int:35",
   "kind": "int",
   "t_mm": 120,
   "axis": [
    [
     2758,
     1530
    ],
    [
     2658,
     1530
    ]
   ]
  },
  {
   "key": "1F:int:36",
   "kind": "int",
   "t_mm": 120,
   "axis": [
    [
     2658,
     9730
    ],
    [
     2658,
     9530
    ]
   ]
  },
  {
   "key": "1F:int:37",
   "kind": "int",
   "t_mm": 120,
   "axis": [
    [
     2858,
     9830
    ],
    [
     2658,
     9730
    ]
   ]
  },
  {
   "key": "1F:int:38",
   "kind": "int",
   "t_mm": 120,
   "axis": [
    [
     2758,
     1730
    ],
    [
     2758,
     1530
    ]
   ]
  },
  {
   "key": "1F:int:39",
   "kind": "int",
   "t_mm": 120,
   "axis": [
    [
     2858,
     1730
    ],
    [
     2758,
     1730
    ]
   ]
  },
  {
   "key": "1F:int:40",
   "kind": "int",
   "t_mm": 120,
   "axis": [
    [
     2758,
     5330
    ],
    [
     2758,
     5530
    ]
   ]
  },
  {
   "key": "1F:int:41",
   "kind": "int",
   "t_mm": 120,
   "axis": [
    [
     2758,
     5530
    ],
    [
     2958,
     5630
    ]
   ]
  },
  {
   "key": "1F:int:42",
   "kind": "int",
   "t_mm": 120,
   "axis": [
    [
     2858,
     1930
    ],
    [
     2858,
     1730
    ]
   ]
  },
  {
   "key": "1F:int:43",
   "kind": "int",
   "t_mm": 120,
   "axis": [
    [
     2958,
     1930
    ],
    [
     2858,
     1930
    ]
   ]
  },
  {
   "key": "1F:int:44",
   "kind": "int",
   "t_mm": 120,
   "axis": [
    [
     2858,
     9930
    ],
    [
     2858,
     9830
    ]
   ]
  },
  {
   "key": "1F:int:45",
   "kind": "int",
   "t_mm": 120,
   "axis": [
    [
     2958,
     9930
    ],
    [
     2858,
     9930
    ]
   ]
  },
  {
   "key": "1F:int:46",
   "kind": "int",
   "t_mm": 120,
   "axis": [
    [
     2958,
     5630
    ],
    [
     2958,
     1930
    ]
   ]
  },
  {
   "key": "1F:int:47",
   "kind": "int",
   "t_mm": 120,
   "axis": [
    [
     2958,
     12030
    ],
    [
     2958,
     9930
    ]
   ]
  },
  {
   "key": "1F:int:48",
   "kind": "int",
   "t_mm": 120,
   "axis": [
    [
     3058,
     6430
    ],
    [
     3058,
     7430
    ]
   ]
  },
  {
   "key": "1F:int:49",
   "kind": "int",
   "t_mm": 120,
   "axis": [
    [
     3358,
     6430
    ],
    [
     3058,
     6430
    ]
   ]
  },
  {
   "key": "1F:int:50",
   "kind": "int",
   "t_mm": 120,
   "axis": [
    [
     3058,
     7430
    ],
    [
     3358,
     7430
    ]
   ]
  },
  {
   "key": "1F:int:51",
   "kind": "int",
   "t_mm": 120,
   "axis": [
    [
     3358,
     2330
    ],
    [
     3358,
     6430
    ]
   ]
  },
  {
   "key": "1F:int:52",
   "kind": "int",
   "t_mm": 120,
   "axis": [
    [
     4058,
     2330
    ],
    [
     3358,
     2330
    ]
   ]
  },
  {
   "key": "1F:int:53",
   "kind": "int",
   "t_mm": 120,
   "axis": [
    [
     3358,
     7430
    ],
    [
     3358,
     9230
    ]
   ]
  },
  {
   "key": "1F:int:54",
   "kind": "int",
   "t_mm": 120,
   "axis": [
    [
     3358,
     9230
    ],
    [
     3458,
     9230
    ]
   ]
  },
  {
   "key": "1F:int:55",
   "kind": "int",
   "t_mm": 120,
   "axis": [
    [
     3458,
     9230
    ],
    [
     3458,
     9330
    ]
   ]
  },
  {
   "key": "1F:int:56",
   "kind": "int",
   "t_mm": 120,
   "axis": [
    [
     3458,
     9330
    ],
    [
     3658,
     9430
    ]
   ]
  },
  {
   "key": "1F:int:57",
   "kind": "int",
   "t_mm": 120,
   "axis": [
    [
     3658,
     9430
    ],
    [
     3658,
     9630
    ]
   ]
  },
  {
   "key": "1F:int:58",
   "kind": "int",
   "t_mm": 120,
   "axis": [
    [
     3658,
     9630
    ],
    [
     3758,
     9630
    ]
   ]
  },
  {
   "key": "1F:int:59",
   "kind": "int",
   "t_mm": 120,
   "axis": [
    [
     3758,
     9630
    ],
    [
     3758,
     9730
    ]
   ]
  },
  {
   "key": "1F:int:60",
   "kind": "int",
   "t_mm": 120,
   "axis": [
    [
     3758,
     9730
    ],
    [
     4058,
     9730
    ]
   ]
  },
  {
   "key": "1F:int:61",
   "kind": "int",
   "t_mm": 120,
   "axis": [
    [
     4058,
     2230
    ],
    [
     4058,
     2330
    ]
   ]
  },
  {
   "key": "1F:int:62",
   "kind": "int",
   "t_mm": 120,
   "axis": [
    [
     6158,
     2230
    ],
    [
     4058,
     2230
    ]
   ]
  },
  {
   "key": "1F:int:63",
   "kind": "int",
   "t_mm": 120,
   "axis": [
    [
     4058,
     9730
    ],
    [
     4058,
     9830
    ]
   ]
  },
  {
   "key": "1F:int:64",
   "kind": "int",
   "t_mm": 120,
   "axis": [
    [
     4058,
     9830
    ],
    [
     5458,
     9830
    ]
   ]
  },
  {
   "key": "1F:int:65",
   "kind": "int",
   "t_mm": 120,
   "axis": [
    [
     5458,